{
  "schemaVersion": "1",
  "toolVersion": "0.4.0",
  "kind": "evidence-manifest",
  "generatedAt": "2026-08-04T22:20:31.894Z",
  "source": {
    "artifactKind": "page-audit",
    "runId": "20260804T222026Z-d19617",
    "target": "http://127.0.0.1:4193/fixed"
  },
  "algorithm": "sha256",
  "summary": {
    "files": 14,
    "bytes": 165398
  },
  "files": [
    {
      "path": "audit-input.json",
      "bytes": 4040,
      "sha256": "50e0b4a0c45ccce5b5670d949a6422f94502d3f30859973403bd3ac7f3042617",
      "mediaType": "application/json"
    },
    {
      "path": "repair-plan.json",
      "bytes": 357,
      "sha256": "2a6449f77ee19eb0a0606b294cc7ed2a88689cc64640e9a804fe68f0b4a3c477",
      "mediaType": "application/json"
    },
    {
      "path": "repair-plan.md",
      "bytes": 444,
      "sha256": "19953b395f01c0cd6c67eabfca891706929ce1eb1de736700a20e998e722b052",
      "mediaType": "text/markdown"
    },
    {
      "path": "report.html",
      "bytes": 37938,
      "sha256": "825ca75dbaeeae8617263d544301073a5d1e074dd68c61221b73dd60fce25583",
      "mediaType": "text/html"
    },
    {
      "path": "report.json",
      "bytes": 4442,
      "sha256": "e11f99c45f6c351eaa6985548a3a0b66d43708ed287b6c7de0314b62c4f2855b",
      "mediaType": "application/json"
    },
    {
      "path": "report.junit.xml",
      "bytes": 991,
      "sha256": "a018419454a16ee5a6fcf8fbd74bd7aab2d45300eb2036ae58fbd5c2c5a635cc",
      "mediaType": "application/xml"
    },
    {
      "path": "report.md",
      "bytes": 1777,
      "sha256": "3f123f5de612ea119d5117a65136f81d65ac47dc75a57351132507969f7fcaa2",
      "mediaType": "text/markdown"
    },
    {
      "path": "report.sarif",
      "bytes": 363,
      "sha256": "303486ef90e5c8a6e7f53ad8ec2a8e4756b3a41ed2262c132c4ae395af9ee86a",
      "mediaType": "application/sarif+json"
    },
    {
      "path": "screenshots/baseline.png",
      "bytes": 19160,
      "sha256": "a9e7809d46016e07662ae8b225a17bbe320468a15b3549b7f63e0f9f582b4033",
      "mediaType": "image/png"
    },
    {
      "path": "screenshots/image-failure.png",
      "bytes": 19160,
      "sha256": "a9e7809d46016e07662ae8b225a17bbe320468a15b3549b7f63e0f9f582b4033",
      "mediaType": "image/png"
    },
    {
      "path": "screenshots/keyboard-tab.png",
      "bytes": 19160,
      "sha256": "a9e7809d46016e07662ae8b225a17bbe320468a15b3549b7f63e0f9f582b4033",
      "mediaType": "image/png"
    },
    {
      "path": "screenshots/long-text.png",
      "bytes": 27904,
      "sha256": "4ac2f77722c1b7d18bb5045d6b514638c93e5959b62a51e629f1ddc76280b2ba",
      "mediaType": "image/png"
    },
    {
      "path": "screenshots/mobile-375.png",
      "bytes": 15400,
      "sha256": "ccedf22e7e4263d8a7cb20d402d87a9a91c4b32cecf1501f977ff2834e29e672",
      "mediaType": "image/png"
    },
    {
      "path": "screenshots/rtl-arabic.png",
      "bytes": 14262,
      "sha256": "176fbb227a4d8025235f87c83236b23d8bc7133ab3c9c7b60599f4479302a094",
      "mediaType": "image/png"
    }
  ]
}
