{
  "schemaVersion": "1",
  "toolVersion": "0.4.0",
  "kind": "evidence-manifest",
  "generatedAt": "2026-08-04T16:32:33.327Z",
  "source": {
    "artifactKind": "page-audit",
    "runId": "reference-demo-v0.4.0",
    "target": "http://127.0.0.1:4173/"
  },
  "algorithm": "sha256",
  "summary": {
    "files": 8,
    "bytes": 126514
  },
  "files": [
    {
      "path": "audit-input.json",
      "bytes": 14140,
      "sha256": "9cbfa41c615a5c5aacb9b9112ef3bc0c824d6419ff5d19b385d6180a9afb15c0",
      "mediaType": "application/json"
    },
    {
      "path": "repair-plan.json",
      "bytes": 8137,
      "sha256": "e4b1b30630613cd3cf1b343fbd990a53dbcbf5632e93c76f836d15b45f6014e6",
      "mediaType": "application/json"
    },
    {
      "path": "repair-plan.md",
      "bytes": 3498,
      "sha256": "a80de3f19a88b82b7a5615d40675d3d79a97b19cfc6a3cba11b33eb473b1c3be",
      "mediaType": "text/markdown"
    },
    {
      "path": "report.html",
      "bytes": 62344,
      "sha256": "41ba2d9dd765687530c7b19f72adf82b2a2fb96767ad4812f841c6138d9a5eb3",
      "mediaType": "text/html"
    },
    {
      "path": "report.json",
      "bytes": 15967,
      "sha256": "be8c9ff22ae8a4fd03e1513b873e837cfa0f935287d02caae0101043a03e807c",
      "mediaType": "application/json"
    },
    {
      "path": "report.junit.xml",
      "bytes": 2066,
      "sha256": "a89373920c10b0910b01b47b9e2a83f135be09a5eb07c94c5cee55f5120e25ed",
      "mediaType": "application/xml"
    },
    {
      "path": "report.md",
      "bytes": 6735,
      "sha256": "2d0a5427b9e1bbd19f9144f94935b8d40215cc878603d6d00a2aad36070f89ea",
      "mediaType": "text/markdown"
    },
    {
      "path": "report.sarif",
      "bytes": 13627,
      "sha256": "a62e6abd0ccae89bfd805b33d57cade5a8a2d3019deb0f0557a701ecfe4cdff2",
      "mediaType": "application/sarif+json"
    }
  ]
}
